{
  "$schema": "https://json-schema.org/draft/2020-12/schema",
  "$comment": "RunSpec v1. This is the requested experiment, not its result. No kubeconfig, tokens, headers, environment dumps, or secret material.",
  "title": "RunSpec",
  "type": "object",
  "additionalProperties": false,
  "required": [
    "schemaVersion",
    "kind",
    "dataClass",
    "runId",
    "mode",
    "patchRequest",
    "environment",
    "workload",
    "load",
    "target",
    "scenario",
    "slo",
    "policy",
    "runtime"
  ],
  "properties": {
    "schemaVersion": { "$ref": "defs.schema.json#/$defs/schemaVersion" },
    "kind": { "const": "RunSpec" },
    "dataClass": { "$ref": "defs.schema.json#/$defs/dataClass" },
    "runId": { "$ref": "defs.schema.json#/$defs/uuid" },
    "mode": {
      "description": "report_only must not ask for a patch. validate_export asks for an API dry-run or a later review export; it does not apply the patch.",
      "enum": ["report_only", "validate_export"]
    },
    "patchRequest": {
      "enum": ["not_requested", "experimental_dry_run", "review_export"]
    },
    "environment": {
      "type": "object",
      "additionalProperties": false,
      "required": ["role", "confirmation"],
      "properties": {
        "role": { "$ref": "defs.schema.json#/$defs/environmentRole" },
        "confirmation": {
          "description": "declared means the caller named the environment. v1 does not claim a cluster probe proved it.",
          "const": "declared"
        }
      }
    },
    "workload": {
      "type": "object",
      "additionalProperties": false,
      "required": ["namespace", "kind", "name", "container", "logicalService", "replicas"],
      "properties": {
        "namespace": { "$ref": "defs.schema.json#/$defs/k8sLabel" },
        "kind": { "const": "Deployment" },
        "name": { "$ref": "defs.schema.json#/$defs/k8sSubdomain" },
        "container": { "$ref": "defs.schema.json#/$defs/k8sLabel" },
        "logicalService": {
          "type": "object",
          "additionalProperties": false,
          "required": ["name", "mapping"],
          "properties": {
            "name": { "type": "string", "minLength": 1, "maxLength": 128 },
            "mapping": { "const": "explicit" }
          }
        },
        "replicas": {
          "type": "object",
          "additionalProperties": false,
          "required": ["desired", "fixedForExperiment"],
          "properties": {
            "desired": { "type": "integer", "minimum": 1 },
            "fixedForExperiment": { "type": "boolean" }
          }
        }
      }
    },
    "load": {
      "type": "object",
      "additionalProperties": false,
      "required": ["mode", "requestedDurationNs"],
      "properties": {
        "mode": { "enum": ["rps", "concurrency", "observe"] },
        "requestedRps": { "type": "integer", "minimum": 1, "maximum": 10000 },
        "concurrency": { "type": "integer", "minimum": 1, "maximum": 1000 },
        "requestedDurationNs": {
          "type": "integer",
          "exclusiveMinimum": 0,
          "maximum": 86400000000000
        }
      },
      "allOf": [
        {
          "if": {
            "properties": { "mode": { "const": "rps" } },
            "required": ["mode"]
          },
          "then": {
            "required": ["requestedRps"],
            "not": { "required": ["concurrency"] }
          }
        },
        {
          "if": {
            "properties": { "mode": { "const": "concurrency" } },
            "required": ["mode"]
          },
          "then": {
            "required": ["concurrency"],
            "not": { "required": ["requestedRps"] }
          }
        },
        {
          "if": {
            "properties": { "mode": { "const": "observe" } },
            "required": ["mode"]
          },
          "then": {
            "not": {
              "anyOf": [
                { "required": ["requestedRps"] },
                { "required": ["concurrency"] }
              ]
            }
          }
        }
      ]
    },
    "target": {
      "type": "object",
      "additionalProperties": false,
      "required": ["namespace", "url"],
      "properties": {
        "serviceName": { "$ref": "defs.schema.json#/$defs/k8sLabel" },
        "namespace": { "$ref": "defs.schema.json#/$defs/k8sLabel" },
        "url": {
          "description": "Null for observe mode. A URL does not by itself prove the Service or the direct Pod route.",
          "oneOf": [
            { "type": "null" },
            { "$ref": "defs.schema.json#/$defs/httpUrl" }
          ]
        },
        "cluster": {
          "description": "Cluster reference without credentials. There is no kubeconfig or token field.",
          "type": "object",
          "additionalProperties": false,
          "required": ["name"],
          "properties": {
            "name": { "type": "string", "minLength": 1 },
            "context": { "type": "string", "minLength": 1 }
          }
        },
        "pod": { "$ref": "defs.schema.json#/$defs/k8sSubdomain" },
        "port": { "type": "integer", "minimum": 1, "maximum": 65535 },
        "httpHost": { "type": "string", "minLength": 1 },
        "tlsServerName": { "type": "string", "minLength": 1 }
      }
    },
    "route": {
      "description": "Requested route. direct_pod does not require target.serviceName. Omission keeps the Service-oriented target.",
      "type": "object",
      "additionalProperties": false,
      "required": ["mode"],
      "properties": {
        "mode": { "enum": ["direct_pod", "service", "ingress", "port_forward"] },
        "requirement": { "enum": ["legacy", "strict_direct"] }
      }
    },
    "runner": {
      "description": "Requested runner placement. These values are not observations.",
      "type": "object",
      "additionalProperties": false,
      "required": ["placement"],
      "properties": {
        "placement": { "enum": ["in_cluster", "external", "unknown"] },
        "namespace": { "$ref": "defs.schema.json#/$defs/k8sLabel" },
        "imageRef": { "type": "string", "minLength": 1 },
        "cpuMilli": { "type": "integer", "minimum": 0 },
        "memoryBytes": { "type": "integer", "minimum": 0 },
        "nodeClass": { "type": "string", "minLength": 1 },
        "zone": { "type": "string", "minLength": 1 }
      }
    },
    "scenario": {
      "type": "object",
      "additionalProperties": false,
      "required": ["id", "wrapper", "latencySemantics", "method", "phases", "authFixture", "dataFixture"],
      "properties": {
        "id": { "type": "string", "minLength": 1, "maxLength": 128 },
        "version": { "type": "string", "minLength": 1, "maxLength": 64 },
        "contentHash": { "$ref": "defs.schema.json#/$defs/sha256" },
        "wrapper": {
          "description": "Adapter identity. name is an open component id, not a closed enum of builtin-get and k6-wrapper. Registration is checked by the load provider, not by this schema alone.",
          "type": "object",
          "additionalProperties": false,
          "required": ["name", "version"],
          "properties": {
            "name": { "$ref": "defs.schema.json#/$defs/componentId" },
            "version": { "type": "string", "minLength": 1, "maxLength": 64 }
          }
        },
        "engine": { "$ref": "defs.schema.json#/$defs/componentIdentity" },
        "capabilities": {
          "description": "Capabilities this run requires. Omitting the array does not add requirements. shell_hook is not a capability.",
          "type": "array",
          "uniqueItems": true,
          "items": { "$ref": "defs.schema.json#/$defs/capability" }
        },
        "latencySemantics": {
          "description": "until_response_headers is the legacy tester: time.Since until http.Client.Do returns, before the body is fully read. It is not k6_http_req_duration. Comparisons require equal semantics.",
          "$ref": "defs.schema.json#/$defs/requestedLatencySemantics"
        },
        "method": { "enum": ["GET", "NONE"] },
        "phases": {
          "type": "array",
          "minItems": 1,
          "maxItems": 3,
          "items": { "$ref": "defs.schema.json#/$defs/phase" },
          "contains": {
            "type": "object",
            "required": ["name", "includedInMeasurement"],
            "properties": {
              "name": { "const": "measured" },
              "includedInMeasurement": { "const": true }
            }
          },
          "minContains": 1,
          "maxContains": 1
        },
        "authFixture": { "$ref": "defs.schema.json#/$defs/fixtureRef" },
        "dataFixture": { "$ref": "defs.schema.json#/$defs/fixtureRef" }
      },
      "allOf": [
        {
          "if": {
            "properties": {
              "wrapper": {
                "properties": { "name": { "const": "builtin-get" } },
                "required": ["name"]
              }
            },
            "required": ["wrapper"]
          },
          "then": {
            "properties": {
              "latencySemantics": { "const": "until_response_headers" },
              "method": { "const": "GET" },
              "wrapper": {
                "properties": {
                  "name": { "const": "builtin-get" },
                  "version": { "const": "legacy-1" }
                }
              },
              "engine": {
                "properties": {
                  "id": { "const": "builtin-get" },
                  "version": { "const": "legacy-1" }
                }
              }
            }
          }
        },
        {
          "if": {
            "required": ["phases", "capabilities"],
            "properties": {
              "capabilities": { "type": "array" },
              "phases": {
                "contains": {
                  "properties": { "name": { "enum": ["warmup", "cooldown"] } },
                  "required": ["name"]
                }
              }
            }
          },
          "then": {
            "properties": {
              "capabilities": {
                "contains": { "const": "warmup_cooldown_phases" }
              }
            }
          }
        }
      ]
    },
    "slo": {
      "description": "Null when there is no load SLO. A null SLO is not_evaluated, not passed. Zero maximumP95LatencyNs disables only the latency gate, matching pkg/loadtest.SLO.",
      "oneOf": [
        { "type": "null" },
        {
          "type": "object",
          "additionalProperties": false,
          "required": ["minimumActualRps", "maximumHttpErrorRate", "maximumP95LatencyNs"],
          "properties": {
            "minimumActualRps": { "type": "number", "minimum": 0 },
            "maximumHttpErrorRate": { "$ref": "defs.schema.json#/$defs/errorRate" },
            "maximumP95LatencyNs": { "$ref": "defs.schema.json#/$defs/durationNs" }
          }
        }
      ]
    },
    "policy": { "$ref": "defs.schema.json#/$defs/policy" },
    "runtime": {
      "type": "object",
      "additionalProperties": false,
      "required": ["profileId", "language", "framework", "workloadShape", "selection", "node"],
      "properties": {
        "profileId": {
          "description": "generic performs no Node.js rules. Further runtimes are added by a later schema version, not by an open string.",
          "enum": ["nodejs", "generic"]
        },
        "language": { "enum": ["javascript", "typescript", "unspecified"] },
        "framework": { "enum": ["express", "unspecified"] },
        "workloadShape": { "const": "http_api" },
        "selection": { "enum": ["explicit", "suggested"] },
        "node": {
          "description": "Support pin chosen by T02. An observed process version belongs in runtime findings, not here.",
          "oneOf": [
            { "type": "null" },
            {
              "type": "object",
              "additionalProperties": false,
              "required": ["support"],
              "properties": {
                "support": { "$ref": "defs.schema.json#/$defs/nodeSupport" }
              }
            }
          ]
        }
      },
      "allOf": [
        {
          "if": {
            "properties": { "profileId": { "const": "nodejs" } },
            "required": ["profileId"]
          },
          "then": {
            "properties": {
              "language": { "enum": ["javascript", "typescript"] },
              "node": { "type": "object" }
            }
          }
        },
        {
          "if": {
            "properties": { "profileId": { "const": "generic" } },
            "required": ["profileId"]
          },
          "then": {
            "properties": {
              "language": { "const": "unspecified" },
              "framework": { "const": "unspecified" },
              "node": { "type": "null" }
            }
          }
        }
      ]
    }
  },
  "allOf": [
    {
      "if": {
        "properties": { "mode": { "const": "report_only" } },
        "required": ["mode"]
      },
      "then": { "properties": { "patchRequest": { "const": "not_requested" } } }
    },
    {
      "if": {
        "properties": { "mode": { "const": "validate_export" } },
        "required": ["mode"]
      },
      "then": {
        "properties": {
          "patchRequest": { "enum": ["experimental_dry_run", "review_export"] }
        }
      }
    },
    {
      "if": {
        "properties": {
          "load": {
            "properties": { "mode": { "const": "observe" } },
            "required": ["mode"]
          }
        },
        "required": ["load"]
      },
      "then": {
        "properties": {
          "target": { "properties": { "url": { "type": "null" } } },
          "slo": { "type": "null" },
          "scenario": {
            "properties": {
              "method": { "const": "NONE" },
              "latencySemantics": { "const": "not_applicable" },
              "wrapper": {
                "properties": {
                  "name": { "const": "none" },
                  "version": { "const": "none" }
                }
              }
            }
          }
        }
      }
    },
    {
      "if": {
        "properties": {
          "load": {
            "properties": { "mode": { "enum": ["rps", "concurrency"] } },
            "required": ["mode"]
          }
        },
        "required": ["load"]
      },
      "then": {
        "properties": {
          "target": { "properties": { "url": { "type": "string" } } },
          "slo": { "type": "object" }
        }
      }
    },
    {
      "if": {
        "not": {
          "required": ["route"],
          "properties": {
            "route": {
              "properties": { "mode": { "const": "direct_pod" } },
              "required": ["mode"]
            }
          }
        }
      },
      "then": {
        "properties": {
          "target": { "required": ["serviceName"] }
        }
      }
    },
    {
      "if": {
        "properties": {
          "route": {
            "properties": {
              "mode": { "const": "direct_pod" },
              "requirement": { "const": "strict_direct" }
            },
            "required": ["mode", "requirement"]
          }
        },
        "required": ["route"]
      },
      "then": {
        "required": ["runner"],
        "properties": {
          "target": { "required": ["cluster", "pod", "port"] },
          "runner": {
            "required": ["placement"],
            "properties": { "placement": { "const": "in_cluster" } }
          },
          "scenario": {
            "required": ["capabilities"],
            "properties": {
              "capabilities": {
                "allOf": [
                  { "contains": { "const": "direct_route_proof" } },
                  { "contains": { "const": "in_cluster_runner" } },
                  { "contains": { "const": "selected_pod_metrics" } }
                ]
              }
            }
          }
        }
      }
    }
  ]
}
