{
  "schemaVersion": "1.0.0",
  "kind": "RunSpec",
  "dataClass": "synthetic_fixture",
  "runId": "0a0a0a0a-0a0a-40a0-80a0-0a0a0a0a0a0a",
  "mode": "report_only",
  "patchRequest": "not_requested",
  "environment": {
    "role": "staging",
    "confirmation": "declared"
  },
  "workload": {
    "namespace": "rightsizer-synthetic",
    "kind": "Deployment",
    "name": "orders-api",
    "container": "api",
    "logicalService": {
      "name": "orders",
      "mapping": "explicit"
    },
    "replicas": {
      "desired": 1,
      "fixedForExperiment": true
    }
  },
  "load": {
    "mode": "rps",
    "requestedRps": 50,
    "requestedDurationNs": 300000000000
  },
  "target": {
    "namespace": "rightsizer-synthetic",
    "url": "http://10.0.0.8:8080/orders",
    "cluster": {
      "name": "staging",
      "context": "staging"
    },
    "pod": "orders-api-a",
    "port": 8080,
    "httpHost": "orders.internal"
  },
  "route": {
    "mode": "direct_pod",
    "requirement": "strict_direct"
  },
  "runner": {
    "placement": "in_cluster",
    "namespace": "load",
    "imageRef": "example.invalid/k6-runner:synthetic",
    "cpuMilli": 100,
    "memoryBytes": 134217728,
    "nodeClass": "staging-standard",
    "zone": "zone-a"
  },
  "scenario": {
    "id": "synthetic-http-get",
    "wrapper": {
      "name": "example-engine",
      "version": "1"
    },
    "latencySemantics": "until_response_headers",
    "method": "GET",
    "phases": [
      {
        "name": "measured",
        "durationNs": 300000000000,
        "includedInMeasurement": true
      }
    ],
    "authFixture": {
      "id": "none",
      "version": "none",
      "secretMaterial": "excluded",
      "comparability": "known"
    },
    "dataFixture": {
      "id": "synthetic-orders-v1",
      "version": "1",
      "secretMaterial": "excluded",
      "comparability": "known"
    },
    "version": "1",
    "contentHash": "abababababababababababababababababababababababababababababababab",
    "engine": {
      "id": "example-engine",
      "version": "1"
    },
    "capabilities": [
      "http_requests",
      "http_errors",
      "actual_http_throughput",
      "latency_until_response_headers",
      "measured_phase_boundaries",
      "direct_route_proof",
      "in_cluster_runner",
      "selected_pod_metrics"
    ]
  },
  "slo": {
    "minimumActualRps": 47.5,
    "maximumHttpErrorRate": 0.01,
    "maximumP95LatencyNs": 1000000000
  },
  "policy": {
    "version": "policy-core-1",
    "cpuPercentile": 95,
    "cpuRequestBufferPercent": 10,
    "memoryBufferPercent": 20,
    "cpuLimit": {
      "mode": "none"
    },
    "memoryLimit": {
      "mode": "request-multiplier",
      "multiplier": 1.2
    },
    "minimumIndependentSamples": 3,
    "pilot": {
      "workloadKind": "Deployment",
      "workloadShape": "http_api",
      "candidateEnvironment": "staging",
      "replicasMustRemainFixed": true,
      "activeAutoscaler": "blocks_candidate",
      "unknownAutoscaler": "blocks_candidate"
    }
  },
  "runtime": {
    "profileId": "nodejs",
    "language": "typescript",
    "framework": "express",
    "workloadShape": "http_api",
    "selection": "explicit",
    "node": {
      "support": {
        "status": "pinned_lts",
        "line": "24"
      }
    }
  }
}
